{"acquisition_id":"official-mnq-202609-5m-inventory-20260622-20260724-v3","artifact_hashes":{"inventory_acquisition_evidence":"936d593953e094ebd8101f647936cefe4d97d5dc4c2fb4144a85156944af1da2","inventory_runtime_capture":"a219a92dfe0968e8fbbd9a35af76a187c86fc025d8d61a4cdfe62eb4e51c3be5","inventory_scan":"5be64081f30db4d238c711bc00abad46fdc41ad65e130df70ea20e4b2ae346aa","ninjatrader_config":"f5fcd60fd68a9efe7d1f84f71857ba2679d82f525cca363050e5fd726f7cca3a","ninjatrader_log":"313d2ac05415c9a81d4f43e9313af26d493999832ff0bc2c1670a83ff7c51e1f","ninjatrader_trace":"7d26ad6e303e27cd4ee618d5df0237d857c736c3a56dfebf5beac69f9e45ec59","scanner":"02955c9e2f6255f4986dcf5bd951779554f0919b2b6abe212d4b6a5e76229f30","toolset_manifest":"17bbd80bcc10e128e38e4285df7480aba4f639ded0cac8b6272ab5f1716ba70f","trading_hours_template":"370b17f23eeea694e686394b5fdb9b55681089c22d5232d5e6a354a314325620"},"bar_series":{"native":true,"type":"Minute","value":5},"calendar_binding":{"calendar_binding_sha256":"e600252cbc4789da12baf99c70da7b2519ac1666945bb4516c3588a6c9f10dde","civil_date_count":33,"civil_date_end":"2026-07-24","civil_date_start":"2026-06-22","earliest_session_begin":"2026-06-21T17:00:00-05:00","latest_session_end":"2026-07-24T16:00:00-05:00","session_count":25,"status":"VERIFIED","trading_hours_name":"CME US Index Futures ETH","trading_hours_template_sha256":"370b17f23eeea694e686394b5fdb9b55681089c22d5232d5e6a354a314325620"},"checkpoint_verification":{"pinned_production_hierarchy_commit":"04a73e1401d44688660b211d9db6918113482856","status":"VERIFIED","trusted_toolset_checkpoint":"a6c368a581d2a92ae681f41f78587a6349fc047f"},"cohort_id":"mnq-202609-5m-v1","contract":{"contract_label":"MNQ SEP26","expiry_month":9,"expiry_year":2026,"full_name":"MNQ SEP26","master_name":"MNQ"},"external_evidence":[{"byte_length":19506,"path":"NinjaTrader.Config.xml","role":"ninjatrader_config","sha256":"f5fcd60fd68a9efe7d1f84f71857ba2679d82f525cca363050e5fd726f7cca3a"},{"byte_length":2101,"path":"ninjatrader_log.txt","role":"ninjatrader_log","sha256":"313d2ac05415c9a81d4f43e9313af26d493999832ff0bc2c1670a83ff7c51e1f"},{"byte_length":19736,"path":"ninjatrader_trace.txt","role":"ninjatrader_trace","sha256":"7d26ad6e303e27cd4ee618d5df0237d857c736c3a56dfebf5beac69f9e45ec59"},{"byte_length":59531,"path":"trading_hours_template.xml","role":"trading_hours_template","sha256":"370b17f23eeea694e686394b5fdb9b55681089c22d5232d5e6a354a314325620"}],"inventory_scan_binding":{"path":"inventory_scan.json","schema_version":"1.0","sha256":"5be64081f30db4d238c711bc00abad46fdc41ad65e130df70ea20e4b2ae346aa"},"provider_acquisition":{"acquisition_id":"official-mnq-202609-5m-inventory-20260622-20260724-v3","active_connection":{"instrument_types":["Future","CryptoCurrency","Index","Option","Stock"],"name":"My NinjaTrader","price_status":"Connected","provider":"Provider31","status":"Connected"},"competing_historical_provider_connections":0,"configuration_binding":{"mode":"UNIQUE_AUTO_ROUTE","preferred_future_connection":"Unknown","preferred_realtime_future_connection":"Unknown","saved_connection_matches":1},"historical_request":{"covers_verified_inventory_bounds":true,"instrument":"MNQ SEP26","observed_at":"2026-10-07T16:01:48.635000+08:00","provider_request_period":"1 Minute","requested_end":"2026-07-27T00:00:00","requested_start":"2026-06-17T00:00:00","source_role":"ninjatrader_trace"},"historical_service":{"connected_at":"2026-10-07T16:00:25.707000+08:00","host":"hds-us-nt-014.ninjatrader.com","name":"NinjaTrader HDS","port":31655,"use_ssl":true},"intended_connection_name":"My NinjaTrader","intended_provider_disconnects":0,"lifecycle":{"adapter_connection_initiated_at":"2026-10-07T16:00:22.736000+08:00","connection_ready_at":"2026-10-07T16:00:25.667000+08:00","inventory_scan_armed_at":"2026-10-07T16:21:45.881527+08:00","inventory_scan_completed_at":"2026-10-07T16:21:46.195956+08:00","post_request_initialized_at":"2026-10-07T16:01:50.256433+08:00","post_request_realtime_at":"2026-10-07T16:01:50.256433+08:00","pre_request_realtime_at":"2026-10-07T16:01:36.985965+08:00","request_observed_at":"2026-10-07T16:01:48.635000+08:00"},"log_timezone_id":"Singapore Standard Time","log_utc_offset":"+08:00","provider_profile_id":"NINJATRADER_TRADOVATE_PROVIDER31_HDS_V1","runtime_provider_id":"Provider31","status":"PROVEN","trace_adapter":"Tradovate.Adapter"},"schema_version":"1.0","status":"PROVEN","toolset_binding":{"aggregate_payload_sha256":"1aef39bc7e6e68b0e92fe33c41b8023b20c9849cee197953b71cd21ca29811b7","pinned_production_hierarchy_commit":"04a73e1401d44688660b211d9db6918113482856","producing_checkpoint":"39c8a342a4636556fcc4f15c11f2d25771ab83da","schema_version":"2.0","stage":"SOURCE_ACQUISITION","status":"FROZEN_FOR_SOURCE_ACQUISITION","trusted_checkpoint":"a6c368a581d2a92ae681f41f78587a6349fc047f"},"transformations":{"back_adjusted":false,"filled":false,"interpolated":false,"resampled":false,"sorted":false,"timezone_converted":false}}
